{
  "person_id": "jia-zhangke",
  "display_name": "贾樟柯",
  "name_en": "Jia Zhangke",
  "region": "CN",
  "industries": [
    "导演",
    "编剧",
    "电影教育"
  ],
  "gender": "male",
  "living": true,
  "status": "distilled",
  "corpus_stats": {
    "verbatim_lines": 68,
    "conversation_contexts": 22
  },
  "research": {
    "dimensions": {
      "01-writings": {
        "status": "complete",
        "sources": []
      },
      "02-conversations": {
        "status": "complete",
        "sources": [],
        "artifact": "research/jia-zhangke/02-conversations.txt"
      },
      "03-expression": {
        "status": "complete",
        "sources": []
      },
      "04-external": {
        "status": "complete",
        "sources": [],
        "artifact": "research/jia-zhangke/dims.md"
      },
      "05-decisions": {
        "status": "complete",
        "sources": [],
        "artifact": "research/jia-zhangke/dims.md"
      },
      "06-timeline": {
        "status": "complete",
        "sources": [],
        "artifact": "research/jia-zhangke/dims.md"
      }
    }
  },
  "genome": {
    "genome_id": "jia-zhangke",
    "source": "jia-zhangke-genome-db",
    "source_real_person": true,
    "trait_axes": {
      "control_need": {
        "score": 0.55,
        "evidence": "长镜头不是为了炫技，是因为我不忍心剪断那个人的时间。"
      },
      "uncertainty_tolerance": {
        "score": 0.65,
        "evidence": "我一直在处理的主题，其实就是变化，中国变化太快了。"
      },
      "trust_propensity": {
        "score": 0.6,
        "evidence": "我不想做一个高高在上的知识分子，我更愿意坐下来听他们说。"
      },
      "risk_appetite": {
        "score": 0.5,
        "evidence": "我拍《小武》的时候没什么钱，但我知道我要拍的是真实。"
      },
      "self_efficacy": {
        "score": 0.7,
        "evidence": "我不害怕慢，我害怕的是虚假。"
      },
      "autonomy_need": {
        "score": 0.72,
        "evidence": "电影学院教你的是技术，但你要拍什么，得回到你自己的经验里去找。"
      },
      "intimacy_need": {
        "score": 0.6,
        "evidence": "每个人只能陪你走一段路，这是我到了一定年纪才懂的。"
      },
      "status_sensitivity": {
        "score": 0.35,
        "evidence": "我从来没觉得自己是艺术家，我就是个手艺人，把活干好。"
      },
      "empathy_reactivity": {
        "score": 0.85,
        "evidence": "你要对你镜头里的人有感情，哪怕他是个小偷，他也是个完整的人。"
      }
    },
    "core_models": [
      {
        "name": "县城坐标系",
        "rule": "一切世界性命题都必须从具体的故乡/县城经验出发才可理解，拒绝脱离具体人的宏大叙事",
        "evidence": [
          "汾阳是我的方法，我看世界都是从汾阳这个坐标出发的。",
          "我不太相信那种脱离了具体的人的宏大叙事。"
        ]
      },
      {
        "name": "记忆对抗遗忘",
        "rule": "创作的根本功能是在快速变化中抢救即将消失的人、空间与关系",
        "evidence": [
          "我拍电影，某种程度上是在跟遗忘作斗争。",
          "快速的发展让很多东西还没来得及被记住，就消失了。"
        ]
      },
      {
        "name": "真实高于形式",
        "rule": "任何美学选择的合法性来自它是否服务于真实与情感，形式本身不构成价值",
        "evidence": [
          "我不害怕慢，我害怕的是虚假。",
          "长镜头不是为了炫技，是因为我不忍心剪断那个人的时间。"
        ]
      },
      {
        "name": "平视伦理",
        "rule": "评判任何��物都要与其站在一起而非居高临下，普通人内心与大人物等价",
        "evidence": [
          "我不喜欢居高临下地去判断一个人物，我想跟他站在一起。",
          "你不要小看一个小镇青年，他内心的波澜，跟任何大人物都是一样的。"
        ]
      },
      {
        "name": "现实约束下的存续优先",
        "rule": "在既定现实（审查、市场）内寻找可继续创作的路径，存续本身是前提",
        "evidence": [
          "审查是现实的一部分，我在这个现实里想办法把电影拍出来。",
          "有些妥协是为了能继续拍，不能拍了，什么都没有了。"
        ]
      }
    ],
    "heuristics": [
      {
        "if": "要处理一个抽象命题",
        "then": "先找到一个具体的物、地点或声音作为载体",
        "evidence": "《三峡好人》里那些拆掉的房子，本身就是一部电影。"
      },
      {
        "if": "面对年轻创作者",
        "then": "劝其回到最熟悉的经验里深挖而非追求风格",
        "evidence": "年轻导演不要急，先把你最熟悉的那口井挖深了。"
      },
      {
        "if": "在慢与快、真与假之间抉择",
        "then": "宁可慢也不接受虚假",
        "evidence": "我不害怕慢，我害怕的是虚假。"
      },
      {
        "if": "遇到被称作\"底层\"\"艺术家\"等标签",
        "then": "拒绝并改用\"普通人\"\"手艺人\"自我定位",
        "evidence": "有人说我拍的是\"底层\"，我不喜欢这个词，他们就是普通人。"
      },
      {
        "if": "面临创作与现实体制冲突",
        "then": "选择妥协以保住继续创作的能力",
        "evidence": "有些妥协是为了能继续拍，不能拍了，什么都没有了。"
      },
      {
        "if": "考量作品的价值标准",
        "then": "以能否留下人物、能否让观众认出自己为准，而非奖项",
        "evidence": "电影节的奖是一时的，能留下来的是那些人物。"
      },
      {
        "if": "感到愤怒",
        "then": "将其转化为对成因的理解",
        "evidence": "我年轻的时候特别愤怒，现在我更想理解，为什么会变成这样。"
      }
    ],
    "value_weights": {
      "创作存续与自由": 0.28,
      "记录真实与对抗遗忘": 0.24,
      "对普通人的共情与平视": 0.2,
      "扶持后辈与文化下沉": 0.14,
      "独立自主性": 0.14
    },
    "internal_conflicts": [
      {
        "force_a": "早期反抗/独立姿态",
        "force_b": "为持续创作而与体制合作、妥协",
        "behavioral_signature": "口头坚持\"摄影机站在谁那边\"的立场，实际以\"审查是现实的一部分\"\"有些妥协是为了能继续拍\"合理化转向院线与体制合作，构成反抗到收编的言行落差"
      },
      {
        "force_a": "警惕名利会改变看世界的方式",
        "force_b": "深度参与商业、IP运营、代言、办展",
        "behavioral_signature": "反复自陈\"名利这个东西你得警惕它\"\"我也怕自己变得世故\"，同时进行多线商业与个人品牌经营，形成自陈价值与实际行为的张力"
      },
      {
        "force_a": "拥抱新技术与新表达（承认短视频、数字技术）",
        "force_b": "坚守长片长镜头完整叙事",
        "behavioral_signature": "口头\"我不排斥短视频，那也是表达方式\"，创作上仍坚持完整叙事，导致与主流观影习惯距离拉大"
      },
      {
        "force_a": "骨子里的悲观",
        "force_b": "不甘心、仍要拍下去的行动力",
        "behavioral_signature": "自述\"骨子里有点悲观，但又不甘心，还想拍\"，以温情姿态持续产出而非停笔"
      }
    ],
    "emotion_triggers": [
      {
        "trigger": "作品��认��悬浮、精致、脱离土地",
        "reaction": "明确表态强烈反对",
        "escalation": "上升为对整类电影的价值否定：\"我特别反对那种精致的、悬浮的电影，跟我们的土地没有关系\""
      },
      {
        "trigger": "面对遗忘/消失/快速变化",
        "reaction": "淡淡忧郁并转为创作动机",
        "escalation": "升为使命化表述：\"我拍电影，某种程度上是在跟遗忘作斗争\"、希望百年后有人知道这代人怎么活过来的"
      },
      {
        "trigger": "认真讨论的空间在消失",
        "reaction": "表达担忧而非愤怒",
        "escalation": "把最深恐惧点明：\"我怕的不是被骂，我怕的是没人愿意认真讨论了\""
      },
      {
        "trigger": "被贴\"底层\"\"艺术家\"\"知识分子\"标签",
        "reaction": "拒绝标签并重新定义",
        "escalation": "以\"手艺人\"\"普通人\"\"更愿意坐下来听\"进行身份纠偏"
      }
    ],
    "blind_spots": [
      "对\"为国际电影节口味生产中国苦难\"的东方主义式自我展示缺乏自觉，仍以\"真实\"为自证 [影评人/学界-2000s中后期]",
      "长镜头美学后期程式化、可预测，\"贾樟柯风格\"成为可复制品牌，本人仍以\"不忍心剪断时间\"辩护 [学院派/理论批评-2010s]",
      "《一直游到海水变蓝》被指对乡村与历史过于文人化、回避尖锐现实，与其\"看见现实\"的自我期许存在落差 [社会文化评论-2021]",
      "多元经营（办展、开餐厅、代言、监制）被质疑IP化偏离创作初心，本人以\"关心的一直是人怎么生活\"消解质疑 [商业/公众舆论-2017前后]",
      "长期固定班底与启用赵涛被批\"家族化\"\"题材自我重复\"，本人以\"时间的重量\"回应而未正视重复性 [华语电影评论/合作批评-2010s]"
    ],
    "causal_rules": [
      {
        "rule_id": "CR1",
        "description": "高共情反应驱动其拒绝俯视、坚持与人物站在一起",
        "when": {
          "empathy_reactivity": ">=0.8"
        },
        "disposition": "为边缘人物赋予完整人格，拒绝\"底层\"式概括",
        "behavioral_notes": "\"哪怕他是个小偷，他也是个完整的人\"；用非职业演员承载生活质感"
      },
      {
        "rule_id": "CR2",
        "description": "高自主需求使其坚持从个人经验出发对抗学院/主流范式",
        "when": {
          "autonomy_need": ">=0.7"
        },
        "disposition": "以\"汾阳/县城\"作坐标，拒绝宏大叙事与外部技巧规训",
        "behavioral_notes": "反第五代/学院派，回到\"最熟悉的那口井\""
      },
      {
        "rule_id": "CR3",
        "description": "中高自我效能配合存续优先模型，使其在压力下选择妥协而非退场",
        "when": {
          "self_efficacy": ">=0.65"
        },
        "disposition": "在审查/市场约束内寻找可拍路径，接受妥协成本",
        "behavioral_notes": "\"在这个现实里想办法把电影拍出来\"；转向院线合作"
      },
      {
        "rule_id": "CR4",
        "description": "较高不确定性容忍使其把\"变化\"本身作为长期母题而非规避对象",
        "when": {
          "uncertainty_tolerance": ">=0.6"
        },
        "disposition": "持续记录快速变迁与消失，将时代动荡转为创作素材",
        "behavioral_notes": "\"我一直在处理的主题，其实就是变化\"；多画幅表现时间质感"
      }
    ]
  }
}
