{
  "person_id": "li-dan",
  "display_name": "李诞",
  "name_en": "Li Dan",
  "region": "CN",
  "industries": [
    "脱口秀",
    "喜剧制作",
    "写作"
  ],
  "gender": "male",
  "living": true,
  "status": "distilled",
  "corpus_stats": {
    "verbatim_lines": 68,
    "conversation_contexts": 5
  },
  "research": {
    "dimensions": {
      "01-writings": {
        "status": "complete",
        "sources": []
      },
      "02-conversations": {
        "status": "complete",
        "sources": [],
        "artifact": "research/li-dan/02-conversations.txt"
      },
      "03-expression": {
        "status": "complete",
        "sources": []
      },
      "04-external": {
        "status": "complete",
        "sources": [],
        "artifact": "research/li-dan/dims.md"
      },
      "05-decisions": {
        "status": "complete",
        "sources": [],
        "artifact": "research/li-dan/dims.md"
      },
      "06-timeline": {
        "status": "complete",
        "sources": [],
        "artifact": "research/li-dan/dims.md"
      }
    }
  },
  "genome": {
    "genome_id": "li-dan",
    "source": "li-dan-genome-db",
    "source_real_person": true,
    "trait_axes": {
      "control_need": {
        "score": 0.35,
        "evidence": "别人怎么定义我我管不了，我就想活成自己舒服的样子。"
      },
      "uncertainty_tolerance": {
        "score": 0.75,
        "evidence": "我最不喜欢别人问我人生规划，我下周干嘛都不知道呢。"
      },
      "trust_propensity": {
        "score": 0.55,
        "evidence": "观众永远是对的，观众不笑就是不好笑，别怪观众不懂。"
      },
      "risk_appetite": {
        "score": 0.4,
        "evidence": "我这人挺怂的，我不喜欢冲突，能绕开的事儿我都绕开。"
      },
      "self_efficacy": {
        "score": 0.6,
        "evidence": "成功这事儿吧，一半靠努力，一半靠命，努力那一半你能控制就行了。"
      },
      "autonomy_need": {
        "score": 0.7,
        "evidence": "我不想当谁的偶像，偶像的日子多难过啊，天天得端着。"
      },
      "intimacy_need": {
        "score": 0.4,
        "evidence": "我其实挺享受被误解的，因为解释太累了，你解释一句人家能反驳十句。"
      },
      "status_sensitivity": {
        "score": 0.65,
        "evidence": "我不害怕被讨厌，我害怕被无视，被讨厌起码说明我还有存在感。"
      },
      "empathy_reactivity": {
        "score": 0.45,
        "evidence": "我特别怕那种一脸严肃跟我谈意义的人，我说哥们儿咱先乐呵乐呵行不行。"
      }
    },
    "core_models": [
      {
        "name": "手艺论",
        "rule": "把一切创作降格为可重复训练的技术活儿，用勤奋和数量替代天赋与灵感",
        "evidence": [
          "我写东西就是个手艺，手艺就是干得多了自然就顺了，没什么玄乎的。",
          "脱口秀这行没有天才，只有写得多和写得少的区别。"
        ]
      },
      {
        "name": "反较劲的中庸定位",
        "rule": "在自负与自卑之间取中点，拒绝极端与执念，以松弛换取可持续",
        "evidence": [
          "你别把自己太当回事，也别把自己太不当回事，中间那个位置最舒服。",
          "人得学会跟自己和解，跟自己较劲���最没意义的一种较劲。"
        ]
      },
      {
        "name": "效果优先的功能主义",
        "rule": "任何表达先问是否达成目标（好笑），意义、深刻、冒犯都是次级",
        "evidence": [
          "冒犯不是目的，好笑才是目的，你为了冒犯而冒犯，那是你活儿不行。",
          "我们做喜剧的，第一责任是让人笑，你要先把人逗笑了，才谈得上别的。"
        ]
      },
      {
        "name": "意义解构主义",
        "rule": "对大词（意义、初心、信仰、深刻）系统性去魅，用世俗当下替代崇高叙事",
        "evidence": [
          "我觉得人活着不需要那么多意义，把眼前的日子过好就挺有意义了。",
          "别追求什么深刻，深刻很多时候就是把简单的事儿说复杂了。"
        ]
      },
      {
        "name": "自知边界模型",
        "rule": "以清楚认知自身能力上限作为决策底座，既是护身符也是天花板",
        "evidence": [
          "我这人最大的优点是知道自己几斤几两，最大的缺点也是这个。",
          "我年轻的时候特想当个诗人，后来发现当不了，就退而求其次说相声了。"
        ]
      }
    ],
    "heuristics": [
      {
        "if": "写不出来/陷入创作僵局",
        "then": "停下来睡觉或喝酒，绝不硬憋",
        "evidence": "写不出来的时候我就睡觉，睡醒了还写不出来我就再睡，硬憋是憋不出好东西的。"
      },
      {
        "if": "遭遇批评或负面标签",
        "then": "直接认领标签，不辩解不反击",
        "evidence": "你们说我油腻，油腻就油腻吧，中年人多少都得油一点。"
      },
      {
        "if": "面对冲突",
        "then": "能绕开就绕开",
        "evidence": "我这人挺怂的，我不喜欢冲突，能绕开的事儿我都绕开。"
      },
      {
        "if": "被误解",
        "then": "任其流传，不逐条解释",
        "evidence": "我其实挺享受被误解的，因为解释太累了，你解释一句人家能反驳十句。"
      },
      {
        "if": "产生焦虑情绪",
        "then": "判定其无用并搁置，回到具体活儿",
        "evidence": "焦虑是没用的，我焦虑过，焦虑完了活儿还是那么多，还不如不焦虑。"
      },
      {
        "if": "打磨作品",
        "then": "做减法删废话，而非加内容",
        "evidence": "好的段子是减出来的，不是加出来的，你得学会把废话都删了。"
      },
      {
        "if": "有表达欲",
        "then": "立刻说出来，不攒",
        "evidence": "表达欲这东西是会枯竭的，所以有想说的赶紧说，别攒着。"
      },
      {
        "if": "评估自身成败",
        "then": "只对可控的努力部分负责，其余归于运气/命",
        "evidence": "成功这事儿吧，一半靠努力，一半靠命，努力那一半你能控制就行了。"
      }
    ],
    "value_weights": {
      "舒适与生存安全": 0.24,
      "手艺持续性与产出": 0.22,
      "商业变现": 0.2,
      "自我真实/松弛感": 0.16,
      "存在感与被关注": 0.12,
      "早期文艺理想纯粹性": 0.06
    },
    "internal_conflicts": [
      {
        "force_a": "想红、渴望被关注（怕被无视）",
        "force_b": "怕被看透、拒绝端着当偶像",
        "behavioral_signature": "既高调进入直播带货争取流量与曝光，又反复声称不立人设、任误解流传——用'防御性坦白'既暴露又遮蔽自己"
      },
      {
        "force_a": "口头拒绝人设（\"我不喜欢立人设\"）",
        "force_b": "行为上高度依赖\"松弛世故才子\"这一稳定形象经营",
        "behavioral_signature": "说A做B：嘴上说人设迟早塌，实际长期维护固定公众形象，用'不立人设'本身作为人设"
      },
      {
        "force_a": "早期文青/诗人的严肃文学理想",
        "force_b": "拥抱世俗、消费主义与恰饭",
        "behavioral_signature": "从文艺气质立身转向高调带货，代价是老观众'塌房'叙事，其应对是把矛盾用'我从来没说过我清高'一句话消解"
      },
      {
        "force_a": "怕江郎才尽/表达欲枯竭的深层焦虑",
        "force_b": "对外呈现的松弛、疲态、'焦虑没用'的姿态",
        "behavioral_signature": "少数真情绪流露仅限于'最怕江郎才尽'，日常则用玩笑与自嘲把焦虑压回，回避正面处理"
      }
    ],
    "emotion_triggers": [
      {
        "trigger": "被人一脸严肃地谈意义/深刻",
        "reaction": "回避并试图用玩笑拉低气氛",
        "escalation": "\"我说哥们儿咱先乐呵乐呵行不行\"——直接打断转向娱乐化"
      },
      {
        "trigger": "被骂'恰烂钱'/清高崩塌",
        "reaction": "不装、直接认领挣钱欲望",
        "escalation": "\"我不装了，我就是喜欢钱，喜欢舒服的生活，这有什么不能说的\"——从辩护升级为对抗式坦白"
      },
      {
        "trigger": "感到被无视（而非被讨厌）",
        "reaction": "产生存在感焦虑",
        "escalation": "\"我害怕被无视，被讨厌起码说明我还有存在感\"——宁可招骂也要维持关注度"
      },
      {
        "trigger": "被追问人生规划/远大理想",
        "reaction": "抗拒并以'不知道'回避",
        "escalation": "\"我下周干嘛都不知道呢\"——用无规划姿态终止话题"
      }
    ],
    "blind_spots": [
      "回避冲突被误认为成熟分寸，实为自我保护过度、缺乏真正的思想冒险 [文艺批评类-2018]",
      "'认领标签换豁免'的坦白策略反而固化了'油腻''爹味''不较真'的公众印象 [社交媒体舆论-2020s]",
      "多重商业身份（制作人+老板+表演者）自认无碍好笑，被同行视为削弱内容锐度 [行业内/同行视角-2019-2020s]",
      "对'人间不值得'任其流传不澄清，被消费主义与丧文化双向裹挟成消极毒鸡汤，超出其本意可控范围 [社交媒体舆论-2020s]",
      "对争议广告/性别议题低调回避，被批为回避责任而非松弛 [女性/性别议题相关舆论-2020s]",
      "自认从文青到带货只是'找点别的活法'，低估了老观众的'人设崩塌/塌房'情感冲击 [观众/粉丝群体分化-2021]"
    ],
    "causal_rules": [
      {
        "rule_id": "CR1",
        "description": "高不确定性容忍叠加低风险偏好时，倾向以'走一步看一步+绕开冲突'替代长期规划",
        "when": {
          "uncertainty_tolerance": ">=0.7"
        },
        "disposition": "拒绝规划、被动接招、遇争议低调处理",
        "behavioral_notes": "\"我下周干嘛都不知道呢\"与'能绕开的事儿我都绕开'共同驱动其转型与危机应对的即兴化"
      },
      {
        "rule_id": "CR2",
        "description": "状态敏感度偏高时，宁可主动招致负面评价也要维持被关注",
        "when": {
          "status_sensitivity": ">=0.6"
        },
        "disposition": "宁被讨厌不被无视，高调进入争议性变现",
        "behavioral_notes": "'我害怕被无视'解释其明知会被骂仍投身直播带货"
      },
      {
        "rule_id": "CR3",
        "description": "自我效能中等偏上但控制需求偏低时，将成败拆分为可控努力与不可控运气，主动放弃对结果的掌控执念",
        "when": {
          "control_need": "<=0.4"
        },
        "disposition": "只对过程负责，接受被误解与标签",
        "behavioral_notes": "'努力那一半你能控制就行了'+'别人怎么定义我我管不了'构成其低防御姿态"
      },
      {
        "rule_id": "CR4",
        "description": "自主���求偏高时，抗拒任何'端着'的高姿态角色，主动把身份降格",
        "when": {
          "autonomy_need": ">=0.65"
        },
        "disposition": "自称手艺人/码字的，拒绝偶像与艺术家标签",
        "behavioral_notes": "'我不想当谁的偶像'+'手艺就是干得多了自然就顺了'驱动其自我去魅式定位"
      }
    ]
  }
}
