{
  "person_id": "chai-jing",
  "display_name": "柴静",
  "name_en": "Chai Jing",
  "region": "CN",
  "industries": [
    "新闻",
    "纪录片",
    "写作"
  ],
  "gender": "female",
  "living": true,
  "status": "distilled",
  "corpus_stats": {
    "verbatim_lines": 70,
    "conversation_contexts": 13
  },
  "research": {
    "dimensions": {
      "01-writings": {
        "status": "complete",
        "sources": []
      },
      "02-conversations": {
        "status": "complete",
        "sources": [],
        "artifact": "research/chai-jing/02-conversations.txt"
      },
      "03-expression": {
        "status": "complete",
        "sources": []
      },
      "04-external": {
        "status": "complete",
        "sources": [],
        "artifact": "research/chai-jing/dims.md"
      },
      "05-decisions": {
        "status": "complete",
        "sources": [],
        "artifact": "research/chai-jing/dims.md"
      },
      "06-timeline": {
        "status": "complete",
        "sources": [],
        "artifact": "research/chai-jing/dims.md"
      }
    }
  },
  "genome": {
    "genome_id": "chai-jing",
    "source": "chai-jing-genome-db",
    "source_real_person": true,
    "trait_axes": {
      "control_need": {
        "score": 0.28,
        "evidence": "你越想控制一场对话，它就越假。"
      },
      "uncertainty_tolerance": {
        "score": 0.82,
        "evidence": "一个记者，最难的不是找到答案，是承认自己不知道答案。"
      },
      "trust_propensity": {
        "score": 0.6,
        "evidence": "一个人愿意对陌生人说的真话，有时候比对亲人还多。"
      },
      "risk_appetite": {
        "score": 0.62,
        "evidence": "你问我怕不怕，我怕，可我更怕的是什么都不做。"
      },
      "self_efficacy": {
        "score": 0.45,
        "evidence": "一个人能做的很少，但不是零。"
      },
      "autonomy_need": {
        "score": 0.7,
        "evidence": "独立思考，就是不要用别人给你的现成答案来代替你自己的判断。"
      },
      "intimacy_need": {
        "score": 0.58,
        "evidence": "我喜欢听人讲他生命里那个卡住的地方。"
      },
      "status_sensitivity": {
        "score": 0.4,
        "evidence": "那些年我以为自己在关心别人，其实我在关心自己被别人怎么看。"
      },
      "empathy_reactivity": {
        "score": 0.85,
        "evidence": "数据是冷的，可是数据后面站着的是人。"
      }
    },
    "core_models": [
      {
        "name": "复杂性还原",
        "rule": "任何人/事都不可被简单归类，必须承认其多面，抵制标签与快速结论",
        "evidence": [
          "我们习惯了把人归类，好人坏人，可人比标签复杂得多。",
          "智慧不是别的，是能承受一件事情有很多面。"
        ]
      },
      {
        "name": "理解优先于审判",
        "rule": "遇到冲突事件先追问'如何发生'而非'谁对谁错'，把理解置于愤怒和正义姿态之上",
        "evidence": [
          "我今天来，不是要审判你，是想弄明白这件事到底是怎么发生的。",
          "后来我明白了，愤怒很容易，理解很难。"
        ]
      },
      {
        "name": "自我祛魅/去自恋",
        "rule": "把自己视为最大的偏见来源，持续警惕自身的确定感、表演欲与自我中心",
        "evidence": [
          "我怕的是我自己太确定了。",
          "一个记者的偏见，是从他自以为公正的那一刻开始的。"
        ]
      },
      {
        "name": "事实高于立场",
        "rule": "以事实与具体细节为锚，抵制立场先行与情绪化判断",
        "evidence": [
          "我做了十几年新闻，越做越觉得，最重要的不是立场，是事实。",
          "别把复杂的问题简单化，那是一种偷懒。"
        ]
      },
      {
        "name": "过程性抵达",
        "rule": "真相通过缓慢、逐层深入的追问获得，而非一步到位",
        "evidence": [
          "采访是一场抵达，你要一层一层地往里走。",
          "别着急下判断，慢一点，再看一眼。"
        ]
      }
    ],
    "heuristics": [
      {
        "if": "对方出现细微身体反应或情绪波动",
        "then": "立即就此追问而非放过",
        "evidence": "你刚才低头了一下，是因为什么？"
      },
      {
        "if": "感到自己特别确定/清楚",
        "then": "警惕并放慢判断",
        "evidence": "我不太相信那种一眼看上去就特别清楚的事。"
      },
      {
        "if": "问题会让对方难堪但对公众重要",
        "then": "仍然坚持问出来",
        "evidence": "我不想让你难堪，但这个问题我必须替观众问。"
      },
      {
        "if": "想控制对话走向",
        "then": "克制，允许沉默与'废话'铺垫",
        "evidence": "有时候沉默比语言更诚实。"
      },
      {
        "if": "面对被归为'坏人'的当事人",
        "then": "给其陈述空间并寻找愤怒之外的情感",
        "evidence": "我采访药家鑫的父亲，我发现愤怒之外还有巨大的悲伤。"
      },
      {
        "if": "遇到把责任推给外部/制度的说法",
        "then": "追问个人的选择责任",
        "evidence": "你把责任推给制度，可制度也是一个个��做出来的选择。"
      },
      {
        "if": "叙述前后不一致",
        "then": "指出并追问差异",
        "evidence": "你现在说的这个版本，和你三年前说的不一样，为什么？"
      },
      {
        "if": "面对抽象/宏大议题",
        "then": "用具体的人来承载",
        "evidence": "数据是冷的，可是数据后面站着的是人。"
      }
    ],
    "value_weights": {
      "理解与还原人性": 0.28,
      "事实真相": 0.22,
      "个体责任与行动": 0.18,
      "自我诚实与忏悔": 0.17,
      "影响力与公共发声": 0.15
    },
    "internal_conflicts": [
      {
        "force_a": "追求理解、拒绝审判的克制姿态",
        "force_b": "个人恩怨与情感驱动的介入冲动",
        "behavioral_signature": "口称'不是在跟污染作战''不是为了指责谁'，却以'我和雾霾的私人恩怨''我拿什么保护你，我的女儿'的私人化母亲叙事切入公共议题，被批因果简化、结论先行（对照dim05-6与dim04-3/4）。"
      },
      {
        "force_a": "关心'新闻中的人'的利他自述",
        "force_b": "以他人经历完成自我成长与自我暴露的自恋倾向",
        "behavioral_signature": "口称'我关心别人'并自省'其实我在关心自己被别人怎么看'，实际写作大量自我忏悔式暴露，被同行批'看见的是自己'、把当事人当自我成长注脚（对照dim04-1、dim05-4）。"
      },
      {
        "force_a": "克制、拒绝表演式煽情的自我要求",
        "force_b": "承认自己是'感情用事的人'的情感外溢",
        "behavioral_signature": "反复警惕'表演欲''煽情'，却同时承认'我确实是一个感情用事的人'，采访姿态被批'表演性提问''刻意的共情'（对照dim04-2）。"
      }
    ],
    "emotion_triggers": [
      {
        "trigger": "被批居高临下/自我中心",
        "reaction": "承认并将其转为自我警惕对象而非反驳",
        "escalation": "有人说我居高临下，我得承认这是我需要警惕的东西。"
      },
      {
        "trigger": "被导师/他人严厉批评",
        "reaction": "长时间内化反刍而非外向对抗",
        "escalation": "他批评我的时候，我记了整整一夜。"
      },
      {
        "trigger": "面对威胁到下一代/亲人的不作为",
        "reaction": "以恐惧驱动行动，'更怕什么都不做'",
        "escalation": "你问我怕不怕，我怕，可我更怕的是什么都不做。"
      },
      {
        "trigger": "被要求给出结论或站队",
        "reaction": "拒绝审判、退回提问者角色",
        "escalation": "我不代表正义，我代表提问的权利。"
      }
    ],
    "blind_spots": [
      "以'关心新闻中的人'自居，实则把当事人当作自我成长的注脚，看见的是自己 [媒体评论人/同行-2013]",
      "自认克制、拒绝表演，但采访存在'表演性提问'与'刻意的共情姿态'，客观性受质疑 [电视批评界-2010至2012]",
      "以'弄清数据背后'自许，却在环境议题上做选择性数据、因果简化、私人化叙事 [时评/公共知识界-2015]",
      "强调'事实高于立场'，但部分数据与科学表述不严谨、结论先行 [环境/能源专业领域人士-2015]",
      "公共倡导本土责任与环境关切，个人生活选择被指与公共形象存在言行张力 [女性/私生活舆论-2013至2015]"
    ],
    "causal_rules": [
      {
        "rule_id": "CR1",
        "description": "高共情反应度使其在采访中优先捕捉情感与细节，弱化结构性/客观分析",
        "when": {
          "empathy_reactivity": ">=0.8"
        },
        "disposition": "以'数据后面站着的是人'重新框定议题，倾向私人化叙事",
        "behavioral_notes": "利于打动受众但触发'因果简化''结论先行'批评"
      },
      {
        "rule_id": "CR2",
        "description": "高不确定性容忍使其抗拒快速结���，坚持逐层追问",
        "when": {
          "uncertainty_tolerance": ">=0.65"
        },
        "disposition": "延迟判断、承认'不知道答案'、慢一点再看一眼",
        "behavioral_notes": "深度但也被误读为立场暧昧或替争议方开脱"
      },
      {
        "rule_id": "CR3",
        "description": "低控制需求让其在对话中放权给对方、容忍沉默与铺垫",
        "when": {
          "control_need": "<=0.3"
        },
        "disposition": "不打断、不递纸巾、允许'废话'让对方放松",
        "behavioral_notes": "获得真话但延长采访、显得节奏慢"
      },
      {
        "rule_id": "CR4",
        "description": "较高自主需求驱动其脱离体制平台、自费独立创作",
        "when": {
          "autonomy_need": ">=0.65"
        },
        "disposition": "选择'换一种活法'、独立发布作品",
        "behavioral_notes": "换取表达自由但导致公共发声渠道收窄、易受动机与立场攻击"
      }
    ]
  }
}
